team,description,created_at,modified_at,created_by,modified_by
Alpha,Core development team responsible for backend and infrastructure.,2025-03-30 12:00:00,2025-03-30 12:00:00,server,server
Bravo,Frontend and UI/UX design team focused on user experience.,2025-03-30 12:00:00,2025-03-30 12:00:00,server,server
Charlie,Marketing and growth team handling outreach and promotions.,2025-03-30 12:00:00,2025-03-30 12:00:00,server,server
Delta,Project management team ensuring deadlines and deliverables.,2025-03-30 12:00:00,2025-03-30 12:00:00,server,server
Echo,Quality assurance team responsible for testing and bug tracking.,2025-03-30 12:00:00,2025-03-30 12:00:00,server,server
Foxtrot,Customer support team handling user inquiries and issues.,2025-03-30 12:00:00,2025-03-30 12:00:00,server,server
Gamma,Operations and HR team responsible for internal processes.,2025-03-30 12:00:00,2025-03-30 12:00:00,server,server